{
 "format": "lunarsim-horizons",
 "version": 1,
 "terrain": "connecting_ridge",
 "description": "Terrain horizon (elevation of the skyline above the local horizontal at the antenna, degrees; exact on the 1,737.4 km sphere) by grid bearing over the part of the sky Earth can occupy, at BASE and at the route sample that is dark from January 2028 to June 2029 (B-55), from the horizon masks of tools/comms/earth_link.py (B-40); and the monthly link fractions of the ISRU->CONSTR leg. Only Earth's wedge is computed: the 80 m far-field terrain was read for that wedge only.",
 "bearing": {
  "start_deg": -12.0,
  "step_deg": 0.1,
  "n": 241,
  "convention": "grid bearing: 0 = +y (grid north), 90 = +x (grid east), the terrain pack's frame; grid bearing = local azimuth + east longitude"
 },
 "antenna_m": 2.5,
 "points": {
  "BASE": {
   "kind": "site",
   "xy_m": [
    7450.0,
    7510.0
   ],
   "z_m": 1957.566,
   "horizon_deg": [
    -1.77,
    -1.767,
    -1.764,
    -1.761,
    -1.757,
    -1.754,
    -1.751,
    -1.748,
    -1.745,
    -1.742,
    -1.739,
    -1.736,
    -1.733,
    -1.73,
    -1.727,
    -1.724,
    -1.721,
    -1.718,
    -1.715,
    -1.712,
    -1.709,
    -1.706,
    -1.703,
    -1.7,
    -1.697,
    -1.701,
    -1.705,
    -1.71,
    -1.714,
    -1.718,
    -1.723,
    -1.727,
    -1.731,
    -1.735,
    -1.739,
    -1.744,
    -1.748,
    -1.752,
    -1.756,
    -1.76,
    -1.764,
    -1.768,
    -1.772,
    -1.776,
    -1.78,
    -1.784,
    -1.788,
    -1.792,
    -1.796,
    -1.799,
    -1.803,
    -1.807,
    -1.811,
    -1.815,
    -1.818,
    -1.822,
    -1.826,
    -1.83,
    -1.833,
    -1.837,
    -1.841,
    -1.844,
    -1.848,
    -1.851,
    -1.855,
    -1.859,
    -1.862,
    -1.866,
    -1.869,
    -1.873,
    -1.876,
    -1.876,
    -1.872,
    -1.869,
    -1.866,
    -1.863,
    -1.86,
    -1.857,
    -1.853,
    -1.85,
    -1.847,
    -1.844,
    -1.841,
    -1.837,
    -1.834,
    -1.831,
    -1.828,
    -1.824,
    -1.821,
    -1.818,
    -1.814,
    -1.811,
    -1.808,
    -1.79,
    -1.771,
    -1.755,
    -1.744,
    -1.736,
    -1.715,
    -1.688,
    -1.66,
    -1.632,
    -1.604,
    -1.573,
    -1.538,
    -1.506,
    -1.476,
    -1.448,
    -1.428,
    -1.405,
    -1.38,
    -1.362,
    -1.35,
    -1.342,
    -1.338,
    -1.338,
    -1.337,
    -1.328,
    -1.309,
    -1.287,
    -1.264,
    -1.239,
    -1.215,
    -1.19,
    -1.168,
    -1.147,
    -1.124,
    -1.104,
    -1.085,
    -1.073,
    -1.055,
    -1.038,
    -1.02,
    -1.005,
    -0.994,
    -0.986,
    -0.976,
    -0.967,
    -0.964,
    -0.969,
    -0.962,
    -0.96,
    -0.961,
    -0.958,
    -0.957,
    -0.954,
    -0.951,
    -0.947,
    -0.947,
    -0.949,
    -0.944,
    -0.945,
    -0.946,
    -0.954,
    -0.962,
    -0.969,
    -0.975,
    -0.981,
    -0.985,
    -0.99,
    -1.0,
    -1.005,
    -1.007,
    -1.01,
    -1.014,
    -1.016,
    -1.013,
    -1.015,
    -1.01,
    -1.002,
    -0.997,
    -0.99,
    -0.991,
    -0.988,
    -0.986,
    -0.985,
    -0.982,
    -0.977,
    -0.965,
    -0.953,
    -0.947,
    -0.937,
    -0.923,
    -0.909,
    -0.89,
    -0.876,
    -0.872,
    -0.869,
    -0.868,
    -0.866,
    -0.871,
    -0.876,
    -0.877,
    -0.873,
    -0.868,
    -0.869,
    -0.871,
    -0.869,
    -0.872,
    -0.876,
    -0.876,
    -0.876,
    -0.884,
    -0.887,
    -0.895,
    -0.906,
    -0.92,
    -0.935,
    -0.954,
    -0.975,
    -1.0,
    -1.023,
    -1.048,
    -1.068,
    -1.089,
    -1.111,
    -1.135,
    -1.167,
    -1.197,
    -1.228,
    -1.258,
    -1.29,
    -1.323,
    -1.354,
    -1.387,
    -1.418,
    -1.446,
    -1.471,
    -1.5,
    -1.528,
    -1.558,
    -1.585,
    -1.615,
    -1.646,
    -1.677,
    -1.705,
    -1.734,
    -1.763,
    -1.791,
    -1.803,
    -1.801
   ]
  },
  "DARK_SAMPLE": {
   "kind": "route sample",
   "sample": 188,
   "xy_m": [
    8270.0,
    7490.0
   ],
   "z_m": 1869.552,
   "legs": [
    "CONSTR->ISRU",
    "ISRU->CONSTR"
   ],
   "horizon_deg": [
    8.593,
    8.582,
    8.57,
    8.559,
    8.548,
    8.537,
    8.526,
    8.515,
    8.504,
    8.493,
    8.482,
    8.471,
    8.461,
    8.45,
    8.44,
    8.429,
    8.419,
    8.409,
    8.398,
    8.388,
    8.377,
    8.367,
    8.356,
    8.345,
    8.334,
    8.323,
    8.309,
    8.299,
    8.291,
    8.282,
    8.273,
    8.264,
    8.257,
    8.249,
    8.242,
    8.235,
    8.228,
    8.222,
    8.215,
    8.208,
    8.202,
    8.197,
    8.192,
    8.187,
    8.183,
    8.178,
    8.174,
    8.17,
    8.166,
    8.149,
    8.13,
    8.109,
    8.087,
    8.066,
    8.044,
    8.023,
    8.002,
    7.98,
    7.957,
    7.94,
    7.928,
    7.915,
    7.903,
    7.891,
    7.878,
    7.866,
    7.854,
    7.842,
    7.83,
    7.818,
    7.806,
    7.795,
    7.783,
    7.772,
    7.762,
    7.754,
    7.747,
    7.74,
    7.732,
    7.725,
    7.718,
    7.71,
    7.703,
    7.697,
    7.691,
    7.684,
    7.678,
    7.672,
    7.666,
    7.659,
    7.654,
    7.649,
    7.644,
    7.639,
    7.634,
    7.629,
    7.623,
    7.617,
    7.611,
    7.606,
    7.601,
    7.595,
    7.59,
    7.585,
    7.571,
    7.557,
    7.544,
    7.53,
    7.517,
    7.503,
    7.49,
    7.477,
    7.464,
    7.451,
    7.438,
    7.425,
    7.412,
    7.4,
    7.389,
    7.378,
    7.367,
    7.357,
    7.346,
    7.339,
    7.332,
    7.327,
    7.321,
    7.315,
    7.308,
    7.302,
    7.296,
    7.29,
    7.284,
    7.277,
    7.271,
    7.264,
    7.258,
    7.242,
    7.225,
    7.208,
    7.192,
    7.175,
    7.158,
    7.142,
    7.124,
    7.107,
    7.09,
    7.072,
    7.055,
    7.039,
    7.025,
    7.012,
    6.998,
    6.984,
    6.971,
    6.957,
    6.944,
    6.928,
    6.908,
    6.889,
    6.869,
    6.849,
    6.829,
    6.809,
    6.789,
    6.769,
    6.756,
    6.745,
    6.734,
    6.724,
    6.715,
    6.706,
    6.698,
    6.69,
    6.682,
    6.674,
    6.666,
    6.656,
    6.638,
    6.619,
    6.6,
    6.582,
    6.563,
    6.545,
    6.529,
    6.514,
    6.507,
    6.506,
    6.518,
    6.53,
    6.542,
    6.554,
    6.565,
    6.557,
    6.527,
    6.498,
    6.47,
    6.443,
    6.416,
    6.391,
    6.367,
    6.342,
    6.319,
    6.295,
    6.272,
    6.259,
    6.245,
    6.233,
    6.222,
    6.21,
    6.199,
    6.187,
    6.176,
    6.161,
    6.146,
    6.131,
    6.116,
    6.1,
    6.09,
    6.083,
    6.074,
    6.063,
    6.052,
    6.041,
    6.033,
    6.025,
    6.016,
    6.008,
    5.998,
    5.987,
    5.979,
    5.973,
    5.966,
    5.96,
    5.954,
    5.948,
    5.943,
    5.938,
    5.933,
    5.928,
    5.923
   ]
  }
 },
 "isru_constr_monthly": {
  "months": [
   "2028-01",
   "2028-02",
   "2028-03",
   "2028-04",
   "2028-05",
   "2028-06",
   "2028-07",
   "2028-08",
   "2028-09",
   "2028-10",
   "2028-11",
   "2028-12",
   "2029-01",
   "2029-02",
   "2029-03",
   "2029-04",
   "2029-05",
   "2029-06",
   "2029-07",
   "2029-08",
   "2029-09",
   "2029-10",
   "2029-11",
   "2029-12",
   "2030-01",
   "2030-02",
   "2030-03",
   "2030-04",
   "2030-05",
   "2030-06",
   "2030-07",
   "2030-08",
   "2030-09",
   "2030-10",
   "2030-11",
   "2030-12",
   "2031-01",
   "2031-02",
   "2031-03",
   "2031-04",
   "2031-05",
   "2031-06",
   "2031-07",
   "2031-08",
   "2031-09",
   "2031-10",
   "2031-11",
   "2031-12"
  ],
  "leg": "ISRU->CONSTR",
  "n_samples": 13,
  "never_linked_samples": 4,
  "all_samples": [
   0.0,
   0.0,
   0.0,
   0.0,
   0.0,
   0.0,
   0.0,
   0.0,
   0.0,
   0.0,
   0.0,
   0.0,
   0.0,
   0.0,
   0.0,
   0.0,
   0.0,
   0.0,
   0.0,
   0.0,
   0.0,
   0.0,
   0.0,
   0.0,
   0.0,
   0.0,
   0.0,
   0.0,
   0.0,
   0.0,
   0.0,
   0.0,
   0.0,
   0.0,
   0.0,
   0.0,
   0.0,
   0.0,
   0.0,
   0.0,
   0.0,
   0.0,
   0.0,
   0.0,
   0.0,
   0.0,
   0.0,
   0.0
  ],
  "all_samples_that_ever_link": [
   0.0,
   0.0,
   0.0,
   0.0,
   0.0,
   0.0,
   0.0,
   0.0,
   0.0,
   0.0,
   0.0,
   0.0,
   0.0,
   0.0,
   0.0,
   0.0,
   0.0,
   0.0,
   0.0228,
   0.0,
   0.0,
   0.0349,
   0.0903,
   0.1022,
   0.0914,
   0.061,
   0.0296,
   0.1139,
   0.1102,
   0.1153,
   0.0968,
   0.0632,
   0.0486,
   0.0685,
   0.1403,
   0.1828,
   0.0672,
   0.0119,
   0.0,
   0.0556,
   0.086,
   0.0889,
   0.0632,
   0.0094,
   0.0,
   0.0,
   0.0444,
   0.0376
  ],
  "dark_sample": [
   0.0,
   0.0,
   0.0,
   0.0,
   0.0,
   0.0,
   0.0,
   0.0,
   0.0,
   0.0,
   0.0,
   0.0,
   0.0,
   0.0,
   0.0,
   0.0,
   0.0,
   0.0,
   0.0228,
   0.0,
   0.0,
   0.0349,
   0.0903,
   0.1022,
   0.0914,
   0.061,
   0.0296,
   0.1139,
   0.1102,
   0.1153,
   0.0968,
   0.0632,
   0.0486,
   0.0685,
   0.1403,
   0.1828,
   0.0672,
   0.0119,
   0.0,
   0.0556,
   0.086,
   0.0889,
   0.0632,
   0.0094,
   0.0,
   0.0,
   0.0444,
   0.0376
  ],
  "note": "share of the month's hours in which every listed sample sees Earth (direct, any part of the disc, hourly samples of earth_link-v1-samples.json.gz). all_samples is 0 throughout: ISRU's own sample never sees Earth."
 },
 "sources": {
  "earth_link": {
   "file": "data/comms/connecting_ridge/earth_link-v1.json",
   "sha256": "6d6ecf4c4b79a7fcc919ce0263531e6c5ebae77b042e7a8cc5192b91df8a4f29"
  },
  "samples": {
   "file": "data/comms/connecting_ridge/earth_link-v1-samples.json.gz",
   "sha256": "ccef3990c85d841a0823021d5a222b761bd88f956ac1fb8bc18702a1473a00fc"
  },
  "near_dem": {
   "kind": "geotiff (float)",
   "file": "data/terrain/_cache/Site01_final_adj_5mpp_surf.tif",
   "sha256": "3ba7b97cb00a2bcf21189c3aeb535f65afc21207154ab9f0d43c5bdc1f7e747e",
   "flag": "Measured",
   "note": "the PGDA LOLA tile the pack was built from"
  },
  "far_dem": {
   "url": "https://pgda.gsfc.nasa.gov/data/LOLA_20mpp/LDEM_80S_80MPP_ADJ.TIF",
   "doi": "10.60903/gsfcpgda-lola-spole",
   "file_sha256": "82030dcbdd7c4bb0c7d858e9b4b293b9f2cda5a543ba31ec0f42784bd6beee5a",
   "sha256_window_float32": "5f589d8a7db877b7eadeec63a7c248d74e8875dd0115b329a93962321a20d0bb"
  },